
mysql> show databases;
+--------------------+
| Database           |
+--------------------+
| information_schema |
| bunny              |
| education          |
| mysql              |
| performance_schema |
| sse                |
| student            |
| su                 |
+--------------------+
8 rows in set (0.00 sec)

mysql> use bunny;
Database changed
mysql> select*from bunny;
+-------+------+------+
| name  | id   | age  |
+-------+------+------+
| bunny |   17 |   18 |
| byee  |    1 |    3 |
| heloo |    3 |    5 |
+-------+------+------+
3 rows in set (0.00 sec)

mysql> alter table bunny add place varchar(10);
Query OK, 3 rows affected (0.06 sec)
Records: 3  Duplicates: 0  Warnings: 0

mysql> alter table bunny add studies varchar(10);
Query OK, 3 rows affected (0.05 sec)
Records: 3  Duplicates: 0  Warnings: 0

mysql> desc bunny;
+---------+-------------+------+-----+---------+-------+
| Field   | Type        | Null | Key | Default | Extra |
+---------+-------------+------+-----+---------+-------+
| name    | varchar(10) | NO   | PRI |         |       |
| id      | int(10)     | YES  |     | NULL    |       |
| age     | int(10)     | YES  | UNI | NULL    |       |
| place   | varchar(10) | YES  |     | NULL    |       |
| studies | varchar(10) | YES  |     | NULL    |       |
+---------+-------------+------+-----+---------+-------+
5 rows in set (0.00 sec)

mysql> update bunny set place='tpt' where id=17;
Query OK, 1 row affected (0.01 sec)
Rows matched: 1  Changed: 1  Warnings: 0

mysql> select*from bunny;
+-------+------+------+-------+---------+
| name  | id   | age  | place | studies |
+-------+------+------+-------+---------+
| bunny |   17 |   18 | tpt   | NULL    |
| byee  |    1 |    3 | NULL  | NULL    |
| heloo |    3 |    5 | NULL  | NULL    |
+-------+------+------+-------+---------+
3 rows in set (0.00 sec)

mysql> update bunny set studies='cse' where id=17;
Query OK, 1 row affected (0.01 sec)
Rows matched: 1  Changed: 1  Warnings: 0

mysql> update bunny set place='kou' where id=17;
Query OK, 1 row affected (0.06 sec)
Rows matched: 1  Changed: 1  Warnings: 0

mysql> update bunny set place='tpt' where id=3;
Query OK, 1 row affected (0.02 sec)
Rows matched: 1  Changed: 1  Warnings: 0

mysql> select*from bunny;
+-------+------+------+-------+---------+
| name  | id   | age  | place | studies |
+-------+------+------+-------+---------+
| bunny |   17 |   18 | kou   | cse     |
| byee  |    1 |    3 | NULL  | NULL    |
| heloo |    3 |    5 | tpt   | NULL    |
+-------+------+------+-------+---------+
3 rows in set (0.00 sec)

mysql> update bunny set place='hyd' where id=3;
Query OK, 1 row affected (0.06 sec)
Rows matched: 1  Changed: 1  Warnings: 0

mysql> select*from bunny;
+-------+------+------+-------+---------+
| name  | id   | age  | place | studies |
+-------+------+------+-------+---------+
| bunny |   17 |   18 | kou   | cse     |
| byee  |    1 |    3 | NULL  | NULL    |
| heloo |    3 |    5 | hyd   | NULL    |
+-------+------+------+-------+---------+
3 rows in set (0.02 sec)

mysql> update bunny set place='tpt' where id=1;
Query OK, 1 row affected (0.01 sec)
Rows matched: 1  Changed: 1  Warnings: 0

mysql> select*from bunny;
+-------+------+------+-------+---------+
| name  | id   | age  | place | studies |
+-------+------+------+-------+---------+
| bunny |   17 |   18 | kou   | cse     |
| byee  |    1 |    3 | tpt   | NULL    |
| heloo |    3 |    5 | hyd   | NULL    |
+-------+------+------+-------+---------+
3 rows in set (0.00 sec)

mysql> update bunny set studies='ec' where id=1;
Query OK, 1 row affected (0.06 sec)
Rows matched: 1  Changed: 1  Warnings: 0

mysql> update bunny set studies='mech' where id=3;
Query OK, 1 row affected (0.02 sec)
Rows matched: 1  Changed: 1  Warnings: 0

mysql> select*from bunny;
+-------+------+------+-------+---------+
| name  | id   | age  | place | studies |
+-------+------+------+-------+---------+
| bunny |   17 |   18 | kou   | cse     |
| byee  |    1 |    3 | tpt   | ec      |
| heloo |    3 |    5 | hyd   | mech    |
+-------+------+------+-------+---------+
3 rows in set (0.00 sec)
mysql> select*from bunny where id=1;
+------+------+------+-------+---------+
| name | id   | age  | place | studies |
+------+------+------+-------+---------+
| byee |    1 |    3 | tpt   | ec      |
+------+------+------+-------+---------+
1 row in set (0.02 sec)

mysql> select*from bunny where name like 'h%';
+-------+------+------+-------+---------+
| name  | id   | age  | place | studies |
+-------+------+------+-------+---------+
| heloo |    3 |    5 | hyd   | mech    |
+-------+------+------+-------+---------+
1 row in set (0.01 sec)

mysql> select*from bunny where name like '%y';
+-------+------+------+-------+---------+
| name  | id   | age  | place | studies |
+-------+------+------+-------+---------+
| bunny |   17 |   18 | kou   | cse     |
+-------+------+------+-------+---------+
1 row in set (0.00 sec)

mysql> select*from bunny where name like '%b_n__%';
+-------+------+------+-------+---------+
| name  | id   | age  | place | studies |
+-------+------+------+-------+---------+
| bunny |   17 |   18 | kou   | cse     |
+-------+------+------+-------+---------+
1 row in set (0.00 sec)
